Product_ID,Product_Name,Brand,Category,Subcategory,Material,Color,Size_Availability,Gender_Orientation,Price,Discount,Rating,Number_of_Reviews,Product_Lifecycle_Status,Launch_Date,Trending_Score,Description
PROD0504,Baggu Hana Sun Hat,Baggu,"Sun Hat,Island Casual Sun Hat,Tropical Vacation Outfit","Vacation Accessories,Casual Swimming Accessories,Casual Accessories",,Pink,['One Size'],Women,123000,48%,4.8,1340,Seasonal,2024-11-17,0.55,"The product is a straw hat. This fedora-style hat features a woven texture with a subtle pink hue contrasted by a darker trim around the base, adding a touch of sophistication. It is suitable for casual outings, perfect for warm, sunny weather, offering both style and sun protection."
PROD0505,Minimal Vyre Flare Sleeves Blouse,Minimal,"Flare Sleeves Blouse,Business Casual Flare Sleeves Blouse,Business Casual Dinner Party Outfit","Interview Tops,Business Casual Dinner Party Tops,Professional Tops",Satin,Off-white,"['S', 'M', 'L', 'XL']",Women,469000,39%,4.0,1373,Clearance,2024-09-28,0.24,"This is a blouse with a relaxed fit and a crinkled fabric texture. It features a deep V-neckline with a tie-front closure and long flared sleeves. The blouse is hip-length, making it ideal for casual outings or summer beach vacations. It is best suited for warm weather."
PROD0506,Filoposy Thala Leather Pants,Filoposy,"Leather Pants,Glam Leather Pants,Glam Concert Outfit","Party Bottoms,Bohemian Concert Bottoms,Streetwear Bottoms",Leather,Black,"['S', 'M', 'L', 'XL']",Men,442000,29%,4.7,977,Seasonal,2024-10-01,0.63,"These are straight-leg trousers featuring a sleek leather texture with lace-up details on the sides. The full-length design is ideal for casual outings or edgy streetwear, suitable for cooler weather."
PROD0507,Bwbyaz Raze Lightweight Cardigan,Bwbyaz,"Lightweight Cardigan,Beachwear Lightweight Cardigan,Summer Vacation Outfit","Swimming Outerwear,Summer Vacation Outerwear,Island Casual Outerwear",Chiffon,Beige,"['S', 'M', 'L', 'XL']",Men,155000,46%,4.6,120,Clearance,2025-06-04,0.73,"This is a relaxed fit open-front top with a kimono-style silhouette. It features a textured fabric and half-length, wide sleeves, providing a casual and laid-back look. The hip-length design makes it ideal for everyday wear, especially during warm weather or in air-conditioned environments."
PROD0508,The Executive Revya Fitted Slacks,The Executive,"Fitted Slacks,Business Casual Fitted Slacks,Business Casual Business Meeting Outfit","Dinner Party Bottoms,Business Casual Dinner Bottoms,Professional Bottoms",Suede,Maroon,"['S', 'M', 'L', 'XL']",Men,379000,30%,4.9,1113,Seasonal,2024-08-31,0.61,"The main product is trousers. These straight-leg trousers offer a classic silhouette with a smooth, flat front and functional side and back pockets. Crafted from a sturdy fabric, they are designed for versatility, making them suitable for both casual and semi-formal occasions, perfect for cooler weather or air-conditioned environments."
PROD0509,Karakiri Miracle Romper,Karakiri,"Romper,Relaxed Romper,Casual Campus Outfit","Cafe Hopping One-Piece,Casual Casual Date One-Piece,Minimalist One-Piece",Denim,Coral,"['S', 'M', 'L', 'XL']",Women,432000,21%,3.2,887,Seasonal,2025-07-11,0.9,"This is an off-shoulder jumpsuit. The jumpsuit features a relaxed fit with wide-leg cropped trousers and an adjustable waist tie, crafted from a smooth fabric in a solid color. The off-shoulder neckline is complemented by short sleeves, and the piece is midi-length, making it suitable for casual outings or summer events in warm weather."
PROD0510,Bwbyaz Kyrie Sheer Cover-up,Bwbyaz,"Sheer Cover-up,Summer Sheer Cover-up,Casual Swimming Outfit","Pool Party Outerwear,Island Casual Swimming Outerwear,Summer Outerwear",Linen,Purple,"['S', 'M', 'L', 'XL']",Women,186000,32%,4.3,5,Seasonal,2025-04-13,0.59,"This is a bohemian-style mini dress featuring a relaxed fit with intricate lace detailing and an embroidered floral pattern. It showcases a deep V-neckline and three-quarter sleeves, enhancing its airy, feminine look. The dress is ideal for casual outings or summer beach vacations and is best suited for warm, humid weather."
PROD0512,Pull&Bear Ivy Platform Shoes,Pull&Bear,"Platform Shoes,Glam Platform Shoes,Glam Party Outfit","Music Festival Shoes,Streetwear Music Festival Shoes,Bohemian Shoes",Cotton,Neon Yellow,"[36, 37, 38, 40, 41, 42]",Women,409000,30%,3.6,1410,Seasonal,2024-09-30,0.12,"The product is a pair of platform heels. These bold, neon platform heels feature a sleek, vibrant satin finish with an adjustable ankle strap for added support and security. Ideal for a night out or a festive event, these shoes are perfectly suited for dry, warm weather, adding a striking element to any outfit."
PROD0513,Kami. Tria Oxfords,Kami.,"Oxfords,Formal Oxfords,Business Casual Dinner Outfit","Wedding Shoes,Formal Dinner Party Shoes,Professional Shoes",Leather,Green,"[37, 38, 39, 40, 41, 42]",Men,348000,43%,3.2,703,Clearance,2024-11-27,0.41,"The product is a pair of shoes. These leather dress shoes feature a sleek, classic Oxford silhouette with a glossy green finish and subtle lacing details. Ideal for formal occasions, their construction is suitable for moderate to cool weather."
PROD0514,Merche Mirada Suede Shoulder Bag,Merche,"Suede Shoulder Bag,Professional Suede Shoulder Bag,Business Casual Dinner Outfit","Dinner Party Bags,Professional Working Bags,Professional Bags",Suede,Coral,['One Size'],Women,331000,18%,4.3,582,Seasonal,2025-05-22,0.3,"This image features a handbag. It has a spacious, rectangular silhouette with a smooth suede texture and sturdy double handles. Ideal for everyday use in warm weather, this handbag is both stylish and functional, perfect for carrying essentials comfortably."
PROD0515,Zara Bolt Leather Boots,Zara,"Leather Boots,Bohemian Leather Boots,Glam Music Festival Outfit","Concert Shoes,Glam Concert Shoes,Edgy Shoes",Leather,Rust,"[36, 39, 41, 42]",Women,152000,46%,4.1,1166,Seasonal,2024-09-19,0.69,"The main product is a pair of boots. These knee-high boots feature a sleek, streamlined silhouette with a sturdy block heel and pointed toe, crafted from smooth suede-like material for a classic yet modern look. Notable details include an adjustable buckle strap at the top for a customizable fit and a side zip closure for easy wear, making them ideal for fall and winter seasons, suitable for both casual outings and more polished occasions in cooler weather."
PROD0516,This Is April Nira Tote Bag,This Is April,"Tote Bag,Streetwear Tote Bag,Minimalist Casual Date Outfit","First Date Bags,Relaxed Campus Bags,Relaxed Bags",Wool,Brown,['One Size'],Women,448000,31%,4.8,1116,New Arrival,2024-09-06,0.62,"The product is a handbag. 

This structured handbag features a sleek, minimalist silhouette with a smooth leather texture and a secure snap closure. Designed for versatility, it offers ample space for essentials, making it suitable for both everyday use and work environments. Perfect for all-weather conditions, it seamlessly transitions from casual outings to business meetings."
PROD0517,New Balance Echo Duffel Bag,New Balance,"Duffel Bag,Sporty Duffel Bag,Sporty Fitness Outfit","Cycling Bags,Sporty Hiking Bags,Sporty Bags",Nylon,Gray,['One Size'],Men,441000,21%,3.7,1417,Clearance,2025-06-13,0.65,"The main product in the image is a duffel bag.

This versatile duffel bag features a spacious main compartment with multiple zippered pockets for organized storage, crafted from a durable, textured fabric for enhanced wear-resistance. Its sleek design includes reinforced carry handles and an adjustable shoulder strap for comfort during travel. Ideal for gym sessions, weekend getaways, or as an extra carry-on, this duffel bag is suitable for all weather conditions, making it a practical choice for both warm and cold environments."
PROD0518,Lumére Tova A-Line Dress,Lumére,"A-Line Dress,Business Casual A-Line Dress,Formal Wedding Outfit","Working One-Piece,Professional Interview One-Piece,Business Casual One-Piece",Silk,Peach,"['S', 'M', 'L', 'XL']",Women,432000,34%,4.0,841,New Arrival,2025-05-03,0.83,"This is a dress. The dress features a classic A-line silhouette with a midi length, offering a flattering fit for everyday wear or casual outings. It has a simple and elegant design with a round neckline and short sleeves, made from a soft fabric in a solid color. Suitable for warm weather, this dress is ideal for a summer day out or a relaxed outdoor gathering."
PROD0519,Hierarchy Olen Ruffled Skirt,Hierarchy,"Ruffled Skirt,Glam Ruffled Skirt,Glam Concert Outfit","Party Bottoms,Streetwear Party Bottoms,Bohemian Bottoms",Leather,Blush Pink,"['S', 'M', 'L', 'XL']",Women,486000,46%,5.0,1278,Clearance,2025-04-21,0.84,"This is a flowy maxi skirt with a layered, asymmetrical silhouette. Its light pink hue and cascading tiers create a soft, elegant look, ideal for summer beach vacations or casual gatherings in warm weather."
PROD0520,Karakiri Bliss Windbreaker,Karakiri,"Windbreaker,Casual Windbreaker,Streetwear Campus Outfit","First Date Outerwear,Minimalist First Date Outerwear,Streetwear Outerwear",Wool,Lavender,"['S', 'M', 'L', 'XL']",Women,181000,25%,4.3,684,New Arrival,2025-02-05,0.5,"The main product is a jacket. This relaxed fit jacket features a sporty silhouette with a color-blocked design in pink and lavender shades, and includes a full-length zipper and adjustable drawstring hood. The long sleeves with elastic cuffs and hip-length cut make it ideal for casual outings. Suitable for cooler weather and perfect for everyday wear or outdoor activities in transitional seasons."
PROD0521,Ecinos Mira Flat Shoes,Ecinos,"Flat Shoes,Minimalist Flat Shoes,Streetwear Hanging Out Outfit","Campus Shoes,Streetwear Casual Date Shoes,Minimalist Shoes",Linen,Lavender,"[37, 40, 41, 42]",Women,473000,17%,4.9,1179,Clearance,2025-06-19,0.85,"The product is a pair of shoes.

These quilted ballet flats feature a streamlined, slip-on silhouette, making them ideal for everyday wear. Their pastel shade and soft texture suit both casual office environments and social gatherings, perfect for warmer weather conditions."
PROD0522,Baggu Mireya Lightweight Cardigan,Baggu,"Lightweight Cardigan,Casual Lightweight Cardigan,Beachwear Beach Outfit","Swimming Outerwear,Tropical Pool Party Outerwear,Summer Outerwear",Rayon,Coral,"['S', 'M', 'L', 'XL']",Women,248000,24%,3.6,761,Clearance,2024-09-28,0.88,"This is a kimono-style cardigan. It features a flowy silhouette with short, wide sleeves, and is made from a lightweight, sheer fabric, perfect for layering. The open-front design provides a relaxed fit that falls to hip-length, making it suitable for casual, everyday wear during warm weather."
PROD0523,Skechers Alva Waist Bag,Skechers,"Waist Bag,Sporty Waist Bag,Sporty Hiking Outfit","Cycling Bags,Sporty Running Bags,Sporty Bags",Polyester,Lavender,['One Size'],Women,266000,41%,4.1,999,Seasonal,2025-05-13,0.56,"This is a waist bag featuring a vibrant tie-dye pattern with pastel hues. It has an adjustable belt for a comfortable fit, a zippered main compartment for secure storage, and is ideal for casual outings or festivals during warm weather."
PROD0524,Puma Mira Running Shoes,Puma,"Running Shoes,Sporty Running Shoes,Sporty Cycling Outfit","Gym Shoes,Sporty Running Shoes,Sporty Shoes",Spandex,Off-white,"[36, 37, 38, 41, 42]",Women,404000,33%,3.1,43,New Arrival,2025-04-10,0.47,"These are athletic sneakers featuring a streamlined design with a textured fabric and smooth, contrasting accents. Ideal for everyday casual outings in warm weather, they provide comfort and style with a padded collar and tongue, along with a strong outsole for durability."
PROD0525,Skechers Suki Walking Shoes,Skechers,"Walking Shoes,Sporty Walking Shoes,Sporty Fitness Outfit","Fitness Shoes,Sporty Running Shoes,Sporty Shoes",Nylon,Beige,"[39, 40]",Men,224000,20%,3.1,1054,Seasonal,2024-10-12,0.37,"This is a slip-on shoe. It features a sleek, athletic design with a durable suede upper and perforated detailing for breathability, ideal for casual outings and light outdoor activities in mild weather."
PROD0526,FERNÉ Daya Denim Shoulder Bag,FERNÉ,"Denim Shoulder Bag,Bohemian Denim Shoulder Bag,Glam Music Festival Outfit","Music Festival Bags,Streetwear Music Festival Bags,Edgy Bags",Denim,Olive,['One Size'],Men,294000,14%,3.9,1252,Clearance,2025-04-18,0.82,"This is a messenger bag. It features a rectangular silhouette with a rugged canvas texture and multiple adjustable straps for versatile carrying; ideal for casual or everyday use, this durable bag suits mild to warm weather, providing ample space for all essentials."
PROD0527,Skechers Mireya Duffel Bag,Skechers,"Duffel Bag,Sporty Duffel Bag,Sporty Running Outfit","Hiking Bags,Sporty Running Bags,Sporty Bags",Nylon,Tan,['One Size'],Men,444000,17%,3.5,1031,New Arrival,2024-12-31,0.55,"The main product is a duffel bag.

This durable, cylindrical duffel bag features a spacious main compartment with secure zipper closures, a front zippered pocket, and dual carrying handles for convenience. Designed with additional side pockets, it suits travel and sports outings, offering easy access to essentials in warm or humid weather conditions."
PROD0528,Puma Kora Leggings,Puma,"Leggings,Sporty Leggings,Sporty Hiking Outfit","Cycling Bottoms,Sporty Hiking Bottoms,Sporty Bottoms",Spandex,Black,"['S', 'M', 'L', 'XL']",Men,163000,12%,4.1,905,Clearance,2024-09-15,0.69,"These are black leggings featuring a sleek, form-fitting silhouette ideal for athletic activities. The design includes a subtle logo detail, made from a smooth, stretch fabric that provides flexibility and comfort. These full-length leggings are suitable for gym workouts and outdoor sports, designed for cooler, air-conditioned environments or moderate weather conditions."
PROD0529,Skechers Onyxia Women Tank Top,Skechers,"Women Tank Top,Sporty Women Tank Top,Sporty Cycling Outfit","Gym Tops,Sporty Fitness Tops,Sporty Tops",Nylon,Yellow,"['S', 'M', 'L', 'XL']",Women,167000,10%,4.6,383,Clearance,2025-04-19,0.24,"This is a tank top. 

This relaxed-fit tank top features a classic scoop neckline and sleeveless design, crafted from lightweight, breathable fabric ideal for active use. The solid color and simple branding allow for versatile styling, while the hip-length cut is perfect for pairing with skirts or shorts. Suitable for gym workouts or casual outings, this top is designed for warm, humid weather."
PROD0530,Bwbyaz Lora Sandals,Bwbyaz,"Sandals,Summer Sandals,Tropical Beach Outfit","Swimming Shoes,Summer Pool Party Shoes,Beachwear Shoes",Rayon,Olive,"[36, 37, 38, 39, 41]",Men,234000,50%,3.8,1259,Seasonal,2024-10-01,0.6,"The product is sandals. These sandals feature a sturdy and durable sole with a comfortable, crisscross fabric strap design, ideal for casual outings. Suitable for warm weather, they are perfect for everyday wear during summer or vacations."
PROD0531,Lumére Noxen High-Rise Slacks,Lumére,"High-Rise Slacks,Professional High-Rise Slacks,Formal Dinner Party Outfit","Working Bottoms,Professional Business Meeting Bottoms,Formal Bottoms",Satin,Pink,"['S', 'M', 'L', 'XL']",Women,182000,20%,4.8,231,New Arrival,2025-05-27,0.38,"These are straight-leg trousers featuring a clean, tailored silhouette and a high-rise waist for a modern fit. Crafted from a soft fabric, they come with subtle seam details and functional side pockets, making them ideal for casual office settings or semi-formal occasions. The full-length cut is suitable for cooler seasons or air-conditioned environments."
PROD0532,Lumére Mono Fitted Blazer,Lumére,"Fitted Blazer,Professional Fitted Blazer,Professional Interview Outfit","Dinner Party Outerwear,Professional Interview Outerwear,Business Casual Outerwear",Satin,Off-white,"['S', 'M', 'L', 'XL']",Women,110000,50%,4.8,778,New Arrival,2024-12-28,0.42,"This is a blazer with a tailored fit, featuring a single-breasted silhouette and a standout black floral embellishment. The blazer includes a classic narrow collar, long sleeves, and a hip-length cut, suitable for formal occasions and ideal for cooler, air-conditioned environments."
PROD0533,Marque Nexa Leather Jacket,Marque,"Leather Jacket,Glam Leather Jacket,Glam Music Festival Outfit","Concert Outerwear,Bohemian Party Outerwear,Glam Outerwear",Leather,Green,"['S', 'M', 'L', 'XL']",Men,420000,18%,3.1,632,Clearance,2025-05-08,0.14,"This is a leather jacket featuring a slim fit silhouette. It showcases a sleek, zip-up front with a quilted design on the shoulders and upper sleeves, enhancing its modern appeal. The jacket has a stand collar and long sleeves, providing coverage and style for cooler weather. Designed to be hip-length, it is ideal for casual outings and transitional seasons."
PROD0534,Barewave Ezra Lace Cardigan,Barewave,"Lace Cardigan,Island Casual Lace Cardigan,Summer Swimming Outfit","Swimming Outerwear,Beachwear Pool Party Outerwear,Summer Outerwear",Lace,Orange,"['S', 'M', 'L', 'XL']",Women,477000,18%,3.2,67,Seasonal,2024-11-16,0.78,"This is a crochet cardigan. The cardigan features a relaxed fit with an open knit pattern, offering a breathable texture and playful visual detail. It has long, slightly flared sleeves and an open front secured with a tie, while the hip-length cut makes it ideal for layering over tops. Perfect for a summer beach vacation, it suits warm, sunny weather beautifully."
PROD0535,Adidas Revya Men Muscle Tee,Adidas,"Men Muscle Tee,Sporty Men Muscle Tee,Sporty Running Outfit","Cycling Tops,Sporty Fitness Tops,Sporty Tops",Nylon,Green,"['S', 'M', 'L', 'XL']",Men,286000,24%,4.9,97,Seasonal,2025-03-26,0.6,"This is a sleeveless sports tank top. It features a relaxed fit with a solid color and subtle side stripes, making it suitable for gym sessions and outdoor sports. The tank has a classic round neckline, providing comfort and ease of movement. The length falls at the hips, offering ample coverage. Ideal for warm weather, it ensures breathability and flexibility for athletic activities."
PROD0536,Kami. Rio Suit Jacket,Kami.,"Suit Jacket,Professional Suit Jacket,Professional Working Outfit","Working Outerwear,Professional Business Meeting Outerwear,Formal Outerwear",Suede,Dark Green,"['S', 'M', 'L', 'XL']",Men,121000,39%,3.9,385,Seasonal,2025-03-21,0.83,"This is a blazer. Featuring a tailored fit, this blazer has a classic silhouette with a textured fabric and is detailed with front flap pockets and button cuffs. It's hip-length and designed with a notched lapel, perfect for formal settings like business meetings or events, and suitable for cooler or air-conditioned environments."
PROD0537,Gaudi Yara Wool Midi Skirt,Gaudi,"Wool Midi Skirt,Streetwear Wool Midi Skirt,Relaxed Cafe Hopping Outfit","Hanging Out Bottoms,Casual First Date Bottoms,Minimalist Bottoms",Wool,Maroon,"['S', 'M', 'L', 'XL']",Women,354000,40%,4.5,716,Seasonal,2025-07-13,0.37,"This is an A-line skirt featuring a classic checkered pattern and structured fabric, with convenient side pockets for added functionality. The skirt falls at a midi length, making it ideal for casual office settings or everyday wear during cooler weather."
PROD0538,Filoposy Nova Bodysuit,Filoposy,"Bodysuit,Streetwear Bodysuit,Streetwear Concert Outfit","Concert Tops,Streetwear Music Festival Tops,Glam Tops",Denim,Off-white,"['S', 'M', 'L', 'XL']",Women,431000,48%,4.0,543,Clearance,2025-03-27,0.86,"This is a long sleeve top. It features a bodycon silhouette with distinct cut-out details on the front, adding a stylish and trendy touch. The neckline is rounded, and it falls to a hip-length, suitable for casual outings or social events. Ideal for cooler weather, this top works well in air-conditioned environments."
PROD0539,Lumére Thala Leather Hand Bag,Lumére,"Leather Hand Bag,Professional Leather Hand Bag,Professional Wedding Outfit","Business Meeting Bags,Professional Interview Bags,Business Casual Bags",Leather,Dusty Rose,['One Size'],Women,382000,29%,3.5,774,New Arrival,2024-12-15,0.6,"This is a handbag. The handbag features a structured silhouette with a smooth leather finish, accented by metallic studs and gold-tone hardware. Ideal for everyday use, it is designed to be a chic accessory for casual outings and suitable for all-weather conditions."
PROD0540,Karakiri Rhea Wide-Leg Denim Jeans,Karakiri,"Wide-Leg Denim Jeans,Minimalist Wide-Leg Denim Jeans,Minimalist Casual Date Outfit","Casual Date Bottoms,Casual First Date Bottoms,Relaxed Bottoms",Denim,Pink,"['S', 'M', 'L', 'XL']",Women,413000,27%,3.1,1037,New Arrival,2024-09-02,0.89,"These trousers feature a straight-leg silhouette with a relaxed fit, ideal for a casual yet stylish look. They boast a unique pink gradient finish with a classic five-pocket design, making them perfect for everyday wear in warm weather."
PROD0541,Kami. Noxen Flare Sleeves Blouse,Kami.,"Flare Sleeves Blouse,Business Casual Flare Sleeves Blouse,Professional Working Outfit","Interview Tops,Professional Business Meeting Tops,Business Casual Tops",Velvet,Mustard,"['S', 'M', 'L', 'XL']",Women,137000,43%,3.7,499,Seasonal,2025-05-06,0.84,"This is a blouse. The blouse features a relaxed fit with an eye-catching silhouette characterized by its dramatic, layered ruffle sleeves and smooth, solid fabric. It has a round neckline and hip-length cut, making it perfect for casual outings or semi-formal occasions. Suitable for warm weather due to its lightweight and airy design."
PROD0543,Ecinos Tova Slip-on,Ecinos,"Slip-on,Minimalist Slip-on,Minimalist Cafe Hopping Outfit","Campus Shoes,Streetwear First Date Shoes,Relaxed Shoes",Rayon,Gray,"[37, 38, 39, 40, 41, 42]",Men,397000,26%,3.5,992,Seasonal,2024-12-27,0.35,"These are loafers featuring a sleek, slip-on silhouette with a smooth suede texture and a subtle penny strap detail. Ideal for casual outings, they pair well with everyday attire and are suitable for warm, dry weather."
PROD0544,FERNÉ Tova Sling Bag,FERNÉ,"Sling Bag,Bohemian Sling Bag,Streetwear Party Outfit","Party Bags,Glam Party Bags,Edgy Bags",Cotton,Pink,['One Size'],Women,490000,13%,4.7,555,Seasonal,2024-11-07,0.8,"The main product is a sweater.

This sweater features a relaxed, slightly oversized fit with a classic cable-knit pattern, perfect for adding texture to any outfit. It has a crew neckline and long sleeves, providing full coverage and warmth, with a hip-length cut ideal for layering. Suitable for casual outings or cozy indoor settings, this sweater is best for cooler weather."
PROD0545,Buttonscarves Vira Flare Sleeves Blouse,Buttonscarves,"Flare Sleeves Blouse,Professional Flare Sleeves Blouse,Formal Dinner Party Outfit","Special Occasion Tops,Formal Business Meeting Tops,Business Casual Tops",Satin,Yellow,"['S', 'M', 'L', 'XL']",Women,380000,47%,3.6,370,Seasonal,2025-01-06,0.3,"This is a blouse with a relaxed fit and flowy silhouette. It features a solid yellow color, half sleeves with a slight flare, and a round neckline. The blouse is hip-length, making it suitable for everyday wear, especially in warm weather."
PROD0546,FERNÉ Nexa Cowboy Leather Hat,FERNÉ,"Cowboy Leather Hat,Edgy Cowboy Leather Hat,Streetwear Party Outfit","Party Accessories,Glam Concert Accessories,Bohemian Accessories",,Orange,['One Size'],Women,459000,27%,3.1,326,Seasonal,2025-05-14,0.56,"The main product is a hat.

This hat features a traditional cowboy silhouette with a wide brim and a structured crown, adorned with a decorative band that includes colorful patterns and textures. Ideal for outdoor events or casual outings, it suits warm weather conditions, providing both style and sun protection."
PROD0547,Cottonink Ezra T-shirt Dress,Cottonink,"T-shirt Dress,Relaxed T-shirt Dress,Casual Casual Date Outfit","Cafe Hopping One-Piece,Casual Casual Date One-Piece,Streetwear One-Piece",Denim,Beige,"['S', 'M', 'L', 'XL']",Women,459000,11%,4.8,1226,New Arrival,2025-05-26,0.88,"This is a dress featuring a relaxed fit with a straight-cut silhouette and a dropped waist leading to a flowy ruffled hem. It has a simple round neckline and short sleeves, offering versatility without excessive detailing. The dress falls at a mini to knee length and is perfect for casual outings or gatherings. Suitable for warm weather, its light fabric and airy design provide comfort and style."
PROD0548,Buttonscarves Onyxia Tulip Fitted Skirt,Buttonscarves,"Tulip Fitted Skirt,Business Casual Tulip Fitted Skirt,Formal Dinner Outfit","Working Bottoms,Business Casual Business Meeting Bottoms,Professional Bottoms",Velvet,Yellow,"['S', 'M', 'L', 'XL']",Women,167000,26%,4.7,513,Seasonal,2024-10-31,0.67,"The main product in the image is a skirt. 

This yellow, knee-length pencil skirt features a tailored fit with a stylish draped detail at the front, creating an asymmetric silhouette that adds a unique touch. Crafted for formal occasions, its sleek design is ideal for professional settings and is best suited for warm weather, offering a vibrant pop of color to your work wardrobe."
PROD0549,Lumére Aeris Tuxedo Jacket,Lumére,"Tuxedo Jacket,Business Casual Tuxedo Jacket,Formal Working Outfit","Working Outerwear,Professional Business Meeting Outerwear,Professional Outerwear",Leather,Gray,"['S', 'M', 'L', 'XL']",Men,345000,10%,3.7,81,Clearance,2024-08-24,0.26,"This is a classic men's suit jacket featuring a tailored fit silhouette. It has a smooth, solid gray fabric with a single-breasted design, two front buttons, and notched lapels, complemented by flap pockets and a chest pocket with a pocket square. The minimalist design makes it ideal for formal occasions and suitable for cooler, air-conditioned environments."
