Product_ID,Product_Name,Brand,Category,Subcategory,Material,Color,Size_Availability,Gender_Orientation,Price,Discount,Rating,Number_of_Reviews,Product_Lifecycle_Status,Launch_Date,Trending_Score,Description
PROD0741,Marque Storm Wide Denim Jeans,Marque,"Wide Denim Jeans,Streetwear Wide Denim Jeans,Glam Party Outfit","Concert Bottoms,Glam Music Festival Bottoms,Streetwear Bottoms",Denim,Light Blue,"['S', 'M', 'L', 'XL']",Women,453000,44%,4.1,1457,Seasonal,2025-03-20,0.86,"Wide-leg trousers with a relaxed fit, featuring a clean, light-wash denim texture and classic button closure. These full-length pants are ideal for casual outings or summer beach vacations, suitable for warm weather."
PROD0742,Inkano Alva Woman Tank Top,Inkano,"Woman Tank Top,Summer Woman Tank Top,Summer Beach Outfit","Beach Tops,Beachwear Beach Tops,Casual Tops",Crochet,Pink,"['S', 'M', 'L', 'XL']",Women,423000,10%,3.7,1349,New Arrival,2024-10-12,0.59,"This is a sleeveless top with a fitted silhouette and a ruched detail on the bust, crafted from a smooth, lightweight fabric for a streamlined look. The square neckline adds a modern touch, and its cropped length makes it ideal for casual outings or layering in summer. Suitable for warm weather."
PROD0743,Kami. Eclipse Tulip Dress,Kami.,"Tulip Dress,Business Casual Tulip Dress,Business Casual Interview Outfit","Dinner Party One-Piece,Formal Special Occasion One-Piece,Professional One-Piece",Chiffon,Lavender,"['S', 'M', 'L', 'XL']",Women,102000,30%,3.4,132,Seasonal,2025-01-15,0.87,"This is a bodycon dress. It features a halter neckline, adding a sophisticated touch to its sleeveless design, and falls to a graceful midi length with a wrap-style skirt. The dress is crafted from a smooth fabric in a solid color, ideal for summer weddings or formal events in warm weather."
PROD0744,Cottonink Orla Straight Denim Jeans,Cottonink,"Straight Denim Jeans,Relaxed Straight Denim Jeans,Minimalist First Date Outfit","Casual Date Bottoms,Minimalist First Date Bottoms,Minimalist Bottoms",Denim,Gray,"['S', 'M', 'L', 'XL']",Men,236000,33%,4.6,275,Clearance,2025-03-23,0.56,"The product is a pair of trousers. These straight-leg jeans feature a classic five-pocket design and a subtle washed grey hue, offering a casual yet stylish look. They are full-length, making them suitable for both everyday wear and casual outings. Ideal for cooler weather or air-conditioned environments."
PROD0745,New Balance Lova Running Shoes,New Balance,"Running Shoes,Sporty Running Shoes,Sporty Hiking Outfit","Cycling Shoes,Sporty Gym Shoes,Sporty Shoes",Spandex,Off-white,"[36, 37, 38, 39, 40, 41, 42]",Men,236000,44%,3.6,1359,New Arrival,2024-08-13,0.54,"The product is a pair of sneakers. These sneakers feature a retro-inspired design with a low-top silhouette and are crafted in a combination of suede and mesh materials for breathability and durability. The shoes sport a distinctive color-block pattern with a bold logo accent, finished with a cushioned sole for added comfort. Ideal for casual outings, these sneakers are suitable for everyday wear in warm or mild weather conditions."
PROD0746,Pull&Bear Tova Graphic T-shirt,Pull&Bear,"Graphic T-shirt,Bohemian Graphic T-shirt,Streetwear Party Outfit","Party Tops,Edgy Concert Tops,Glam Tops",Mesh,Copper,"['S', 'M', 'L', 'XL']",Men,494000,35%,3.2,749,Clearance,2025-01-20,0.54,"**Product Description:**

This relaxed fit t-shirt features a bold, graphic print with the phrase ""Evolve or Repeat"" on the front, adding a touch of personality to your casual wardrobe. It has a classic crew neckline and short sleeves, making it versatile and comfortable for everyday wear. The t-shirt falls to a hip-length hem, suitable for pairing with jeans or shorts. Ideal for everyday casual outings, this t-shirt is perfect for warm weather."
PROD0747,New Balance Noxen Basketball Shoes,New Balance,"Basketball Shoes,Sporty Basketball Shoes,Sporty Fitness Outfit","Cycling Shoes,Sporty Fitness Shoes,Sporty Shoes",Polyester,Black,"[36, 38, 40, 42]",Men,162000,44%,4.6,313,New Arrival,2024-09-17,0.12,"The product is a pair of athletic shoes. Designed with a sleek, low-top silhouette, these shoes feature a textured fabric for enhanced grip and durability, along with prominent branding details. Ideal for everyday athletic activities, they offer a versatile style suitable for both casual wear and intense workouts. The shoes are best suited for various weather conditions, providing comfort in both warm and moderately cool environments."
PROD0748,This Is April Alva Bomber Jacket,This Is April,"Bomber Jacket,Minimalist Bomber Jacket,Relaxed Hanging Out Outfit","Casual Date Outerwear,Streetwear Campus Outerwear,Casual Outerwear",Linen,Off-white,"['S', 'M', 'L', 'XL']",Women,467000,27%,3.7,834,Clearance,2024-07-16,0.96,"This is a bomber jacket featuring a relaxed fit with a smooth, quilted texture and ribbed edges. The design includes a classic crew neckline and long sleeves with a zip front closure. Its hip-length cut makes it suitable for layering in cool, transitional weather, perfect for casual outings or traveling."
PROD0749,Naomi Ilara Shorts,Naomi,"Shorts,Summer Shorts,Casual Beach Outfit","Vacation Bottoms,Summer Swimming Bottoms,Island Casual Bottoms",Crochet,Beige,"['S', 'M', 'L', 'XL']",Women,410000,36%,4.0,363,New Arrival,2024-10-05,0.82,"These are crochet shorts with a relaxed fit silhouette, featuring a detailed open-knit pattern and an adjustable drawstring waist. The shorts are thigh-length, making them ideal for casual outings or beach vacations, and are best suited for warm, sunny weather conditions."
PROD0750,Exsport Zela Women Compression Shirt,Exsport,"Women Compression Shirt,Sporty Women Compression Shirt,Sporty Running Outfit","Cycling Tops,Sporty Running Tops,Sporty Tops",Spandex,Lavender,"['S', 'M', 'L', 'XL']",Women,285000,42%,5.0,1016,New Arrival,2024-11-17,0.62,"This is a sports top. Designed with a fitted silhouette, this athletic top features a solid color with subtle mesh panels on the sides for added breathability. The crew neckline and short sleeves provide a classic, versatile look. It is hip-length, making it ideal for gym workouts or outdoor activities. Suitable for warm or humid weather."
PROD0751,FERNÉ Perry Denim Shoulder Bag,FERNÉ,"Denim Shoulder Bag,Bohemian Denim Shoulder Bag,Streetwear Party Outfit","Party Bags,Glam Concert Bags,Bohemian Bags",Denim,Navy Blue,['One Size'],Women,157000,16%,4.5,904,Clearance,2024-10-04,0.52,"The main product is a handbag. This handbag features a unique denim design with a structured silhouette and decorative elements including lace-up detailing and pocket-style stitching, evoking a casual, stylish look. Ideal for everyday use, it is suitable for various occasions, particularly in warm weather, offering a functional and fashionable accessory choice."
PROD0752,Nike Vexi Crop Tops,Nike,"Crop Tops,Sporty Crop Tops,Sporty Gym Outfit","Running Tops,Sporty Gym Tops,Sporty Tops",Nylon,Off-white,"['S', 'M', 'L', 'XL']",Women,405000,38%,4.9,41,Clearance,2025-05-12,0.56,"This is a long sleeve top. It has a fitted silhouette with a smooth, solid fabric texture, featuring a scoop neckline and long sleeves. The top is cropped in length, making it suitable for casual outings or everyday wear in cooler, air-conditioned environments."
PROD0753,Puma Oasis Running Shoes,Puma,"Running Shoes,Sporty Running Shoes,Sporty Running Outfit","Gym Shoes,Sporty Cycling Shoes,Sporty Shoes",Polyester,Orange,"[36, 37, 39, 40, 41]",Men,432000,34%,3.6,424,Clearance,2025-02-19,0.83,"These are running shoes with a sleek, aerodynamic silhouette designed for performance. They feature vibrant orange and black athletic branding, breathable mesh uppers, and cushioned soles for comfort. Suitable for jogging and intense workouts, these shoes are ideal for warm, dry weather conditions."
PROD0754,Bwbyaz Suki Sandals,Bwbyaz,"Sandals,Casual Sandals,Beachwear Pool Party Outfit","Pool Party Shoes,Beachwear Vacation Shoes,Island Casual Shoes",Lace,Gold,"[37, 38, 39, 40, 41, 42]",Women,100000,13%,4.4,991,New Arrival,2025-05-04,0.56,"These are strappy flat sandals designed with thin cross-over straps. They feature a sleek metallic finish, open toe design, and a cushioned footbed for comfort. Suitable for casual outings, these sandals are ideal for warm, sunny weather."
PROD0755,Naomi Aeris Ruffle Floral Dress,Naomi,"Ruffle Floral Dress,Beachwear Ruffle Floral Dress,Casual Pool Party Outfit","Beach One-Piece,Summer Beach One-Piece,Casual One-Piece",Crochet,White,"['S', 'M', 'L', 'XL']",Women,317000,27%,3.0,1288,New Arrival,2024-08-14,0.48,"This is a tiered maxi dress featuring a flowy A-line silhouette, adorned with delicate floral prints and a subtly textured fabric. It has ruffled shoulder straps and a sweetheart neckline, adding to its romantic appeal, while the full-length cascading tiers make it perfect for summer beach vacations or garden parties in warm weather."
PROD0756,Zara Aeris High-Rise Flare Denim Jeans,Zara,"High-Rise Flare Denim Jeans,Glam High-Rise Flare Denim Jeans,Bohemian Music Festival Outfit","Music Festival Bottoms,Streetwear Music Festival Bottoms,Glam Bottoms",Denim,Pink,"['S', 'M', 'L', 'XL']",Women,128000,29%,3.1,223,New Arrival,2025-07-08,0.65,"The main product in the image is trousers. 

These trousers feature a wide-leg silhouette in a soft pink hue with classic five-pocket styling and a zip fly with a button closure, offering a relaxed fit ideal for casual outings. With their full-length design, they are perfect for everyday wear during mild to warm weather."
PROD0757,Pull&Bear Mono Sneakers,Pull&Bear,"Sneakers,Glam Sneakers,Edgy Music Festival Outfit","Music Festival Shoes,Streetwear Party Shoes,Edgy Shoes",Denim,Brown,"[36, 37, 38, 39, 40, 41]",Men,259000,32%,4.8,1415,New Arrival,2025-05-22,0.16,"The product is a pair of sneakers. These sneakers feature a sleek, low-top silhouette with a textured, crocodile-print leather finish, offering a stylish look for casual outings."
PROD0758,Nike Vexi Men Compression Shirt,Nike,"Men Compression Shirt,Sporty Men Compression Shirt,Sporty Hiking Outfit","Hiking Tops,Sporty Running Tops,Sporty Tops",Cotton Blends,Maroon,"['S', 'M', 'L', 'XL']",Men,312000,45%,3.5,596,New Arrival,2025-05-12,0.78,"This is a fitted short-sleeve top. Designed with a streamlined silhouette, it features a smooth fabric texture enhancing its sleek appearance. The crew neck complements the short sleeves, offering a classic sporty look. Hip-length in design, this top is ideal for gym sessions or active pursuits. Suitable for warm, humid weather, it provides comfort and breathability."
PROD0759,Filoposy Flair Platform Shoes,Filoposy,"Platform Shoes,Streetwear Platform Shoes,Bohemian Music Festival Outfit","Party Shoes,Glam Music Festival Shoes,Glam Shoes",Leather,Pink,"[36, 37, 38, 39, 40, 41, 42]",Women,367000,42%,3.5,1278,New Arrival,2024-10-07,0.2,"The product is a pair of platform heels. These shoes feature a block heel and a strappy, open-toe design with delicate ankle straps for added elegance, crafted from glossy satin fabric. They are suitable for evening occasions and are ideal for warm weather."
PROD0760,Naomi Mireya Ruffle Flowy Skirt,Naomi,"Ruffle Flowy Skirt,Beachwear Ruffle Flowy Skirt,Beachwear Pool Party Outfit","Pool Party Bottoms,Island Casual Swimming Bottoms,Island Casual Bottoms",Lace,Peach,"['S', 'M', 'L', 'XL']",Women,194000,23%,3.7,952,New Arrival,2025-07-13,0.85,"This is a tiered maxi skirt featuring a flowy silhouette with intricate lace detailing. The skirt is designed with multiple cascading ruffles, offering an elegant texture and visual interest, suitable for summer beach vacations. Ideal for warm, humid weather, its light fabric ensures comfort and style."
PROD0761,Silque Tria Espadrilles,Silque,"Espadrilles,Casual Espadrilles,Casual Vacation Outfit","Beach Shoes,Beachwear Beach Shoes,Tropical Shoes",Chiffon,Brown,"[37, 40, 41, 42]",Men,115000,16%,3.2,1165,Seasonal,2024-09-10,0.84,"The main product is a shoe.

This classic espadrille offers a relaxed fit with a soft suede upper and a durable jute sole, providing a casual yet stylish appeal. Its slip-on design makes it convenient for everyday wear, particularly suited for warm weather and summer outings."
PROD0762,Silque Tara Wedges,Silque,"Wedges,Summer Wedges,Beachwear Vacation Outfit","Swimming Shoes,Casual Swimming Shoes,Summer Shoes",Crochet,Brown,"[36, 38, 39, 40, 41, 42]",Women,294000,31%,3.0,764,New Arrival,2024-10-29,0.91,"The product is a pair of wedge sandals. These sandals feature a woven leather upper with an ankle strap and a high platform wedge heel made from espadrille-style jute, ideal for warm, sunny weather. Suitable for casual summer outings, the open-toe design ensures comfort and breathability."
PROD0763,Filoposy Olen Sunglasses,Filoposy,"Sunglasses,Bohemian Sunglasses,Bohemian Concert Outfit","Music Festival Accessories,Glam Party Accessories,Streetwear Accessories",,Lavender,['One Size'],Women,216000,33%,3.5,1187,Seasonal,2024-12-01,0.94,"I'm unable to identify individuals or specific details about people, but I can see the product is sunglasses, which don't have specific features like clothing. They have an oval frame with purple-tinted lenses, making them ideal for protecting your eyes from bright sunlight. Perfect for casual outings and suitable for sunny weather."
PROD0764,Filoposy Zane Leather Belt,Filoposy,"Leather Belt,Bohemian Leather Belt,Bohemian Concert Outfit","Concert Accessories,Bohemian Music Festival Accessories,Glam Accessories",,Blush,['One Size'],Women,187000,43%,4.6,220,Clearance,2025-03-02,0.97,"The product is a belt. This belt features a smooth, subtle textured design, complemented by a polished, rounded metal buckle for a classic finish. Ideal for everyday wear, it's suitable for adjusting to various fits in warm or cooler weather."
PROD0765,Barewave Airi Hawaiian Shirt,Barewave,"Hawaiian Shirt,Island Casual Hawaiian Shirt,Casual Vacation Outfit","Pool Party Tops,Casual Beach Tops,Summer Tops",Rayon,Maroon,"['S', 'M', 'L', 'XL']",Men,286000,12%,3.1,346,Clearance,2025-05-31,0.85,"This is a short-sleeve, relaxed fit shirt with a vibrant floral print. It features an open collar, hip-length cut, and is ideal for casual outings or summer beach vacations in warm weather."
PROD0766,Cottonink Bliss T-shirt Dress,Cottonink,"T-shirt Dress,Streetwear T-shirt Dress,Relaxed Campus Outfit","Hanging Out One-Piece,Streetwear Campus One-Piece,Casual One-Piece",Linen,Lilac,"['S', 'M', 'L', 'XL']",Women,167000,41%,3.7,620,Seasonal,2025-03-05,0.32,"This is a sleeveless shirt dress with a relaxed fit and a straight silhouette. It features a button-down front and a self-tie belt, crafted from a soft lavender fabric. The dress has a classic collar and falls to a mini length, making it ideal for casual outings and summer gatherings. Suitable for warm weather."
PROD0768,Adidas Nova Sneakers,Adidas,"Sneakers,Sporty Sneakers,Sporty Fitness Outfit","Cycling Shoes,Sporty Fitness Shoes,Sporty Shoes",Polyester,Gray,"[38, 39]",Men,245000,45%,4.4,756,New Arrival,2024-10-05,0.67,"The product is a pair of sneakers.

These sneakers feature a classic low-top silhouette with a smooth suede exterior and iconic side stripes, offering both style and comfort. Ideal for casual outings and suitable for moderate weather conditions."
PROD0769,Minimal Fleur A-Line Dress,Minimal,"A-Line Dress,Professional A-Line Dress,Professional Dinner Party Outfit","Business Meeting One-Piece,Formal Wedding One-Piece,Business Casual One-Piece",Suede,Lavender,"['S', 'M', 'L', 'XL']",Women,466000,33%,4.0,609,Seasonal,2025-01-24,0.55,"The main product is a dress. This sleeveless, A-line dress features a distinctive twisted knot neckline that adds an elegant touch to the design, and it flows gracefully to a midi length. Crafted from a smooth, solid fabric, the dress is perfect for formal occasions or sophisticated gatherings, ideal for transitioning from spring to summer due to its suitability for warm weather."
PROD0770,Lumére Zyren Belted Evening Gown,Lumére,"Belted Evening Gown,Business Casual Belted Evening Gown,Formal Business Meeting Outfit","Wedding One-Piece,Professional Dinner One-Piece,Professional One-Piece",Satin,Coral,"['S', 'M', 'L', 'XL']",Women,474000,15%,4.5,1068,Seasonal,2025-03-07,0.2,"This is a one-shoulder, bodycon midi dress featuring an asymmetrical silhouette with a structured fit. The dress is designed with a peplum detail at the waist and a seamless finish, perfect for formal events or cocktail parties in warm weather."
PROD0771,Gaudi Vania Mules,Gaudi,"Mules,Streetwear Mules,Casual First Date Outfit","Hanging Out Shoes,Relaxed Cafe Hopping Shoes,Casual Shoes",Wool,Off-white,"[36, 38, 39, 40, 41, 42]",Women,449000,28%,3.4,550,New Arrival,2025-01-20,0.81,"The product is a pair of shoes. These slip-on mules feature a minimalist design with a sleek, square toe and a comfortable, low block heel, made from smooth leather for a polished look. Ideal for everyday wear and suitable for warm weather, these shoes offer effortless style and are perfect for casual outings or smart-casual work environments."
PROD0772,This Is April Ezra Cap,This Is April,"Cap,Casual Cap,Casual Casual Date Outfit","First Date Hats,Streetwear Campus Hats,Minimalist Hats",Wool,Lavender,"['S', 'M', 'L', 'XL']",Women,399000,19%,3.4,287,Clearance,2024-08-29,0.58,"The main product is a cap.

This classic baseball cap features a relaxed fit silhouette in a soft, pastel lavender hue, adorned with subtle embroidered text on the front. Crafted from breathable cotton, it includes an adjustable strap at the back for a comfortable, personalized fit. Ideal for casual outings and everyday wear, this cap suits warm, sunny weather and adds a stylish pop of color to your ensemble."
PROD0773,Nike Perry Drawstring Bag,Nike,"Drawstring Bag,Sporty Drawstring Bag,Sporty Running Outfit","Fitness Bags,Sporty Hiking Bags,Sporty Bags",Spandex,Purple,['One Size'],Women,268000,50%,4.6,873,Clearance,2024-10-04,0.45,"This is a drawstring backpack. It features a simple and practical design with a single compartment and a lightweight fabric, making it ideal for casual outings or gym trips; it suits warm to mild weather with its airy construction."
PROD0775,Bwbyaz Miracle Sunglasses,Bwbyaz,"Sunglasses,Island Casual Sunglasses,Beachwear Swimming Outfit","Beach Accessories,Island Casual Pool Party Accessories,Tropical Accessories",,Pink,['One Size'],Women,223000,48%,3.8,1408,Seasonal,2025-01-26,0.86,"This image features a pair of sunglasses. The sunglasses have a bold, angular design with a sturdy pink frame, complemented by dark, tinted lenses for optimal sun protection. Ideal for everyday wear, they are perfect for sunny days and add a pop of color to casual outings in warm weather."
PROD0776,This Is April Sora Chinos,This Is April,"Chinos,Relaxed Chinos,Casual Casual Date Outfit","Casual Date Bottoms,Streetwear Hanging Out Bottoms,Casual Bottoms",Linen,Rust,"['S', 'M', 'L', 'XL']",Men,416000,10%,3.4,1071,New Arrival,2024-07-26,0.11,"The product is trousers. These straight-leg trousers feature a tailored fit, crafted from a smooth fabric with a flat front and subtle button accents at the waistband. The design includes standard side and back pockets for practicality. The ankle-length cut makes them suitable for both working formal and smart-casual occasions, ideal for cooler or air-conditioned environments."
PROD0778,Ecinos Echo Sweater,Ecinos,"Sweater,Minimalist Sweater,Minimalist Casual Date Outfit","Casual Date Tops,Minimalist Hanging Out Tops,Streetwear Tops",Linen,Powder Blue,"['S', 'M', 'L', 'XL']",Women,480000,50%,3.7,1166,Clearance,2025-07-02,0.52,"This is a sweater with a relaxed fit. It features ribbed detailing on the cuffs and hem, a crew neckline, and long sleeves. The length falls at the hip, making it versatile for layering. Suitable for casual outings, it is ideal for cooler weather or air-conditioned environments."
PROD0779,Karakiri Tova T-shirt Dress,Karakiri,"T-shirt Dress,Streetwear T-shirt Dress,Casual Casual Date Outfit","Cafe Hopping One-Piece,Streetwear Casual Date One-Piece,Minimalist One-Piece",Wool,Pink,"['S', 'M', 'L', 'XL']",Women,347000,44%,4.8,1245,Seasonal,2024-08-03,0.11,"This product is a shirt dress. It features a relaxed fit with a straight silhouette, button-down front, and three-quarter length sleeves, finished with a classic collar neckline. The dress falls to a mini length, making it suitable for casual outings or summer beach vacations. Ideal for warm, humid weather, it provides comfort and style."
PROD0780,Skechers Raya Track Pants,Skechers,"Track Pants,Sporty Track Pants,Sporty Fitness Outfit","Running Bottoms,Sporty Running Bottoms,Sporty Bottoms",Spandex,Green,"['S', 'M', 'L', 'XL']",Men,259000,29%,3.8,1104,Clearance,2025-05-29,0.35,"These are straight-leg trousers with a relaxed fit, featuring a solid green color and subtle piping detail along the sides. The trousers are full-length, suitable for everyday casual wear and ideal for cooler weather or air-conditioned settings."
PROD0782,Cottonink Mira Denim Jacket,Cottonink,"Denim Jacket,Relaxed Denim Jacket,Casual Casual Date Outfit","Casual Date Outerwear,Streetwear Hanging Out Outerwear,Casual Outerwear",Denim,Lavender,"['S', 'M', 'L', 'XL']",Women,302000,43%,3.8,965,Clearance,2025-01-09,0.96,"The main product is a jacket.

This cropped jacket has a straight, relaxed fit and features a classic button-up front with two chest pockets for added utility. It has a traditional collar and long sleeves, making it ideal for layering in transitional weather. Designed for everyday wear, this jacket suits cooler, air-conditioned environments or mild outdoor conditions."
PROD0783,Merche Calie Kitten Heels,Merche,"Kitten Heels,Business Casual Kitten Heels,Business Casual Dinner Party Outfit","Interview Shoes,Business Casual Wedding Shoes,Business Casual Shoes",Chiffon,Pink,"[36, 37, 38, 41, 42]",Women,185000,38%,3.5,682,Clearance,2025-05-09,0.85,"The main product is a pair of shoes. These elegant slingback heels feature a sleek and pointed toe silhouette with a chic cut-out design, crafted from smooth pink fabric. Ideal for formal occasions, they are perfect for warm weather, adding a touch of sophistication to your ensemble."
PROD0784,FERNÉ Nyxa Bandana,FERNÉ,"Bandana,Glam Bandana,Glam Music Festival Outfit","Concert Accessories,Streetwear Party Accessories,Bohemian Accessories",,Green,['One Size'],Men,381000,40%,4.7,855,Seasonal,2024-09-04,0.46,"Bandana: This versatile bandana features a classic paisley print on soft, woven fabric, perfect for casual everyday wear or accessorizing outfits for outdoor activities. Suitable for warm weather, it can be styled around the neck or as a headband for added flair."
PROD0785,Buttonscarves Nalia Pointed Flats,Buttonscarves,"Pointed Flats,Professional Pointed Flats,Formal Working Outfit","Special Occasion Shoes,Professional Working Shoes,Formal Shoes",Chiffon,Gold,"[36, 37, 38, 41, 42]",Women,117000,47%,3.1,298,Seasonal,2025-07-08,0.36,"The main product in the image is a pair of flat shoes. 

These sleek, gold metallic flat shoes feature a pointed toe design and a minimalist slingback strap for a contemporary silhouette, perfect for transitioning from casual outings to semi-formal events. Ideal for warmer weather, this versatile footwear adds a touch of elegance while ensuring comfort for all-day wear."
PROD0786,Naomi Jira Shorts,Naomi,"Shorts,Casual Shorts,Tropical Pool Party Outfit","Pool Party Bottoms,Island Casual Beach Bottoms,Beachwear Bottoms",Chiffon,Peach,"['S', 'M', 'L', 'XL']",Women,363000,38%,3.9,1484,Clearance,2024-11-27,0.68,"The main product is a pair of shorts.

These flowy shorts feature a relaxed fit with ruffled details along the side, adding a touch of feminine elegance. Made from a lightweight fabric, they are ideal for warm weather and a casual summer outing."
PROD0787,Minimal Revya Bowtie,Minimal,"Bowtie,Professional Bowtie,Business Casual Working Outfit","Interview Accessories,Business Casual Special Occasion Accessories,Formal Accessories",,Gold,['One Size'],Men,170000,44%,3.5,100,Clearance,2024-08-12,0.21,"This is a bow tie with a classic butterfly silhouette, featuring a smooth, satin-like texture. It is well-suited for formal occasions such as weddings or business events and is ideal for cooler, air-conditioned environments."
PROD0790,Adidas Ivy Track Pants,Adidas,"Track Pants,Sporty Track Pants,Sporty Running Outfit","Running Bottoms,Sporty Fitness Bottoms,Sporty Bottoms",Nylon,Yellow,"['S', 'M', 'L', 'XL']",Women,127000,18%,3.4,1282,Seasonal,2025-04-21,0.74,"The main product in the image is a pair of trousers. These straight-leg trousers feature a relaxed fit with bold side stripes and an elastic waistband, ideal for easy wear. Made from soft, breathable fabric, they are full-length and well-suited for casual outings or gym sessions in warm weather."
PROD0791,New Balance Kyrie Walking Shoes,New Balance,"Walking Shoes,Sporty Walking Shoes,Sporty Gym Outfit","Cycling Shoes,Sporty Gym Shoes,Sporty Shoes",Polyester,Amber,"[36, 38, 39, 40, 41, 42]",Men,465000,34%,3.4,1339,Seasonal,2024-11-03,0.48,"These are casual sneakers featuring a low-top silhouette with a knitted upper and a textured fabric finish, complemented by sturdy laces and a durable rubber sole. Suitable for everyday wear, these shoes are ideal for warm or mild weather, providing comfort and style for casual outings."
