Product_ID,Product_Name,Brand,Category,Subcategory,Material,Color,Size_Availability,Gender_Orientation,Price,Discount,Rating,Number_of_Reviews,Product_Lifecycle_Status,Launch_Date,Trending_Score,Description
PROD0273,Velvet Riot Aeris Suede Shoulder Bag,Velvet Riot,"Suede Shoulder Bag,Formal Suede Shoulder Bag,Business Casual Interview Outfit","Dinner Party Bags,Formal Special Occasion Bags,Professional Bags",Velvet,Rose Gold,['One Size'],Women,230000,46%,3.2,278,Seasonal,2025-07-10,0.74,"This is a handbag. A structured handbag with a sleek, rectangular silhouette features a smooth leather finish and a front flap secured with a metallic clasp. Compact in size, it is suited for casual outings or smart-casual events, and it works well in warm weather conditions."
PROD0274,Skechers Zenya Sweatpants,Skechers,"Sweatpants,Sporty Sweatpants,Sporty Cycling Outfit","Hiking Bottoms,Sporty Hiking Bottoms,Sporty Bottoms",Cotton Blends,Taupe,"['S', 'M', 'L', 'XL']",Women,463000,33%,3.2,1444,Clearance,2024-10-27,0.34,"This product is a pair of joggers featuring a slim, tapered fit that provides a streamlined silhouette. Made from a soft, stretchy fabric, these joggers include an elastic waistband with a drawstring and convenient side pockets. Ideal for casual outings or lounging, they offer comfort in cooler or air-conditioned environments."
PROD0275,Pull&Bear Serel Denim Shorts,Pull&Bear,"Denim Shorts,Streetwear Denim Shorts,Edgy Party Outfit","Concert Bottoms,Streetwear Concert Bottoms,Bohemian Bottoms",Denim,Off-white,"['S', 'M', 'L', 'XL']",Women,225000,31%,4.6,1270,Clearance,2024-08-10,0.41,"These are high-waisted denim shorts with a relaxed fit silhouette, featuring distressed details and a classic five-pocket design. The shorts are thigh-length, ideal for casual everyday wear during warm weather."
PROD0276,Karakiri Luxe Jumpsuit,Karakiri,"Jumpsuit,Relaxed Jumpsuit,Relaxed Hanging Out Outfit","First Date One-Piece,Minimalist First Date One-Piece,Streetwear One-Piece",Cotton,Amber,"['S', 'M', 'L', 'XL']",Women,116000,43%,3.9,884,Clearance,2025-07-12,0.85,"This is a sleeveless jumpsuit. It features a relaxed fit with a draped cowl neckline and wide-leg pants, offering a fluid silhouette ideal for summer events. The solid color enhances its versatility, making it suitable for warm weather occasions, while the lightweight fabric ensures comfort."
PROD0277,Berrybenka Aven Stiletto Heels,Berrybenka,"Stiletto Heels,Professional Stiletto Heels,Professional Interview Outfit","Working Shoes,Professional Dinner Shoes,Business Casual Shoes",Chiffon,Coral,"[37, 42]",Women,213000,12%,4.8,1177,Clearance,2025-03-28,0.22,"The main product is a pair of high heels.

These elegant pumps feature a sleek, pointed-toe silhouette with a smooth, solid color finish and a stiletto heel, defining a classic and versatile design suited for formal occasions or professional settings. Ideal for warmer weather, they offer a refined aesthetic that complements tailored attire."
PROD0278,Bwbyaz Orla Flare Shorts,Bwbyaz,"Flare Shorts,Beachwear Flare Shorts,Island Casual Swimming Outfit","Beach Bottoms,Tropical Beach Bottoms,Tropical Bottoms",Lace,Beige,"['S', 'M', 'L', 'XL']",Women,197000,45%,3.1,1400,Seasonal,2025-03-01,0.62,"The main product is a skirt. 

This flowy, A-line mini skirt features a soft fabric with a subtle sheen, offering a comfortable fit with a wide waistband for easy slip-on. Ideal for summer beach vacations, this skirt suits warm weather settings perfectly."
PROD0279,3Second Aeris Cap,3Second,"Cap,Relaxed Cap,Streetwear Casual Date Outfit","Campus Hats,Minimalist Cafe Hopping Hats,Relaxed Hats",Rayon,Lavender,"['S', 'M', 'L', 'XL']",Women,114000,41%,4.0,672,New Arrival,2024-07-25,0.35,"The product is a cap.

This stylish cap features a sleek, structured design with a smooth, solid color finish and subtle logo embroidery on the front. Ideal for casual outings or sports activities, it suits warm weather and provides comfortable sun protection."
PROD0280,This Is April Airi Romper,This Is April,"Romper,Streetwear Romper,Streetwear Campus Outfit","Hanging Out One-Piece,Casual Cafe Hopping One-Piece,Casual One-Piece",Rayon,Magenta,"['S', 'M', 'L', 'XL']",Women,107000,42%,4.2,1181,Clearance,2025-04-14,0.26,"This is a relaxed-fit playsuit featuring an elastic waistband and a round neckline with short sleeves. The playsuit is crafted from soft fabric with a rich magenta hue and includes practical pockets on the shorts. The length is short, making it ideal for casual summer outings in warm weather."
PROD0281,HiGirlsLabel Laymira Beach Bag,HiGirlsLabel,"Beach Bag,Island Casual Beach Bag,Tropical Beach Outfit","Pool Party Bags,Casual Pool Party Bags,Island Casual Bags",Chiffon,Pink,['One Size'],Women,424000,10%,3.7,1199,New Arrival,2025-03-27,0.43,I’m unable to identify this type of product for description creation.
PROD0282,HiGirlsLabel Yara Beach Bag,HiGirlsLabel,"Beach Bag,Casual Beach Bag,Summer Pool Party Outfit","Pool Party Bags,Summer Pool Party Bags,Beachwear Bags",Chiffon,Blue,['One Size'],Men,154000,32%,4.5,879,New Arrival,2024-08-06,0.12,"The product is a bag. 

This versatile bag features a structured, spacious silhouette with multiple compartments for organized storage, including exterior pockets for easy access. Made from durable fabric, it includes sturdy handles and a detachable shoulder strap for comfortable carrying. Suitable for everyday use, it is ideal for both work and travel, and fits seamlessly into a variety of weather conditions."
PROD0283,Nike Celeste Sports Backpack,Nike,"Sports Backpack,Sporty Sports Backpack,Sporty Hiking Outfit","Running Bags,Sporty Gym Bags,Sporty Bags",Nylon,Brown,['One Size'],Men,114000,30%,4.9,395,Seasonal,2025-05-07,0.16,"The product is a backpack. This durable backpack features a sleek, rectangular silhouette with multiple compartments for easy organization, including a spacious main compartment and front zippered pocket. Made from sturdy material, it has adjustable padded shoulder straps for comfort, making it ideal for everyday use or casual trips. Suitable for all seasons."
PROD0284,Filoposy Flex Leather Pants,Filoposy,"Leather Pants,Glam Leather Pants,Streetwear Concert Outfit","Music Festival Bottoms,Bohemian Music Festival Bottoms,Streetwear Bottoms",Leather,Lavender,"['S', 'M', 'L', 'XL']",Women,261000,34%,4.4,16,New Arrival,2024-11-19,0.46,"These straight-leg trousers feature a sleek silhouette with a soft lavender hue and a high-waist design, complemented by belt loops and a clean front. Crafted from a stretchy fabric, they offer both comfort and style, suitable for office wear or casual outings in warm, mild weather."
PROD0285,Skechers Thala Joggers,Skechers,"Joggers,Sporty Joggers,Sporty Running Outfit","Cycling Bottoms,Sporty Fitness Bottoms,Sporty Bottoms",Nylon,Red,"['S', 'M', 'L', 'XL']",Men,137000,34%,3.3,608,Clearance,2024-08-10,0.64,"These are straight-leg trousers featuring an elastic waistband for a comfortable fit. The design includes side pockets, a subtle logo detail, and soft fabric texture, making them ideal for casual or athletic settings. The trousers are full-length, suitable for cooler, air-conditioned environments."
PROD0286,Lumére Mono Leather Hand Bag,Lumére,"Leather Hand Bag,Formal Leather Hand Bag,Formal Dinner Party Outfit","Working Bags,Formal Dinner Party Bags,Business Casual Bags",Leather,Beige,['One Size'],Women,188000,24%,4.9,456,Clearance,2024-08-19,0.43,"This product is a handbag. It features a structured, rectangular silhouette with a pebbled leather texture, and includes dual top handles and a detachable shoulder strap for versatility. Ideal for formal or business occasions, the handbag's medium size is suitable for year-round use in both warm and cooler environments."
PROD0287,Karakiri Bliss Crossbody,Karakiri,"Crossbody,Relaxed Crossbody,Relaxed Cafe Hopping Outfit","Hanging Out Bags,Relaxed First Date Bags,Streetwear Bags",Linen,Green,['One Size'],Men,354000,39%,3.1,1195,Clearance,2025-05-06,0.85,"This is a crossbody bag. Designed with a structured, rectangular silhouette, this bag features a textured leather exterior with multiple zippered compartments for organized storage. The adjustable shoulder strap ensures a comfortable fit, making it suitable for everyday use in versatile settings. Ideal for all seasons."
PROD0288,Gaudi Mirada Windbreaker,Gaudi,"Windbreaker,Casual Windbreaker,Casual Hanging Out Outfit","Campus Outerwear,Minimalist Cafe Hopping Outerwear,Casual Outerwear",Linen,Brown,"['S', 'M', 'L', 'XL']",Men,310000,28%,4.3,20,New Arrival,2024-10-16,0.27,"This is a jacket with a relaxed fit and a sleek silhouette. It features a front zipper closure, a hood, and elasticated cuffs, along with zippered pockets for added functionality. Designed with long sleeves and hip-length coverage, it's ideal for casual outings or transitional weather, providing comfort in cooler, air-conditioned environments."
PROD0289,Velvet Riot Raze Tuxedo Jacket,Velvet Riot,"Tuxedo Jacket,Formal Tuxedo Jacket,Formal Business Meeting Outfit","Interview Outerwear,Formal Dinner Party Outerwear,Professional Outerwear",Velvet,Olive Green,"['S', 'M', 'L', 'XL']",Men,263000,28%,4.4,1049,New Arrival,2024-09-16,0.96,"This is a suit jacket. The jacket features a tailored fit with a sleek silhouette, crafted from a smooth, satin-like fabric that adds a touch of sheen, along with a classic notch lapel and button details. It is designed with a single-breasted closure and includes a chest pocket for a pocket square or handkerchief. The jacket is best suited for formal occasions such as weddings or black-tie events and is ideal for cooler, air-conditioned environments."
PROD0290,Silque Zyra Lightweight Cardigan,Silque,"Lightweight Cardigan,Summer Lightweight Cardigan,Summer Beach Outfit","Pool Party Outerwear,Beachwear Beach Outerwear,Beachwear Outerwear",Crochet,Maroon,"['S', 'M', 'L', 'XL']",Men,274000,10%,4.4,620,New Arrival,2024-09-21,0.96,"The main product is a cardigan.

This cardigan features a relaxed fit with a classic button-down front and ribbed cuffs, offering a versatile layering option. Made from a lightweight knit, it has a smooth texture that is breathable, making it suitable for transitional weather. The cardigan is hip-length, designed without a collar, and has long sleeves, perfect for casual outings or office settings in cooler environments."
PROD0291,Kami. Celeste Wide-Leg Trousers,Kami.,"Wide-Leg Trousers,Business Casual Wide-Leg Trousers,Professional Interview Outfit","Special Occasion Bottoms,Formal Interview Bottoms,Formal Bottoms",Chiffon,Powder Blue,"['S', 'M', 'L', 'XL']",Women,200000,18%,4.9,196,Seasonal,2025-01-24,0.49,"These are high-waisted, wide-leg trousers with a structured silhouette and a smooth fabric finish. They feature a tailored fit with belt loops and discreet pleats for added style, making them ideal for a professional setting or formal occasions. The full-length design suits cooler or air-conditioned environments."
PROD0292,Merche Tova Belt,Merche,"Belt,Professional Belt,Professional Dinner Party Outfit","Wedding Accessories,Formal Business Meeting Accessories,Professional Accessories",,Powder Blue,['One Size'],Women,402000,37%,3.3,55,Clearance,2024-11-19,0.3,"The product is a belt. This sleek, light blue belt features a smooth texture with a metallic buckle embossed with brand details, offering a polished finish perfect for adding a touch of sophistication to any outfit. Suitable for everyday wear, it complements both casual and formal attire and is ideal for all-weather use."
PROD0293,Puma Echo Waterproof Shell,Puma,"Waterproof Shell,Sporty Waterproof Shell,Sporty Hiking Outfit","Hiking Outerwear,Sporty Gym Outerwear,Sporty Outerwear",Cotton Blends,Olive,"['S', 'M', 'L', 'XL']",Men,344000,32%,3.6,1259,New Arrival,2025-01-18,0.62,"This is a jacket featuring a relaxed fit and a sleek silhouette. It has a smooth, solid fabric with zipper details, a front chest pocket, and side pockets for practicality. The jacket features a hood for added protection and long sleeves, extending to hip length. Perfect for outdoor activities or casual outings, it's suited for cooler, windy, or rainy weather."
PROD0294,Velvet Riot Hana Wide-Leg Trousers,Velvet Riot,"Wide-Leg Trousers,Formal Wide-Leg Trousers,Formal Working Outfit","Working Bottoms,Business Casual Dinner Bottoms,Business Casual Bottoms",Velvet,Mauve,"['S', 'M', 'L', 'XL']",Women,323000,29%,3.2,671,New Arrival,2025-04-18,0.52,"The product is a pair of trousers. These trousers feature a wide-leg silhouette made from a smooth, satin-like fabric, offering an elegant drape and lustrous finish. Designed with a high-rise waistband, they are full-length, making them suitable for formal occasions or evening events. Ideal for warm weather, the trousers provide a lightweight feel that complements both casual and dressy tops."
PROD0295,Ecinos Vyre Mules,Ecinos,"Mules,Streetwear Mules,Minimalist Casual Date Outfit","Casual Date Shoes,Casual Campus Shoes,Minimalist Shoes",Wool,Lavender,"[36, 38, 40, 41]",Women,242000,40%,4.1,927,Clearance,2025-05-14,0.34,"This is a loafer. Crafted in a sleek, slip-on silhouette, this loafer features a smooth leather texture with a classic round toe and subtle stitching detail. Suitable for everyday casual settings, it is ideal for warm, dry weather."
PROD0296,Cottonink Onyxia Romper,Cottonink,"Romper,Casual Romper,Relaxed Hanging Out Outfit","Casual Date One-Piece,Relaxed Casual Date One-Piece,Minimalist One-Piece",Wool,Lavender,"['S', 'M', 'L', 'XL']",Women,306000,26%,4.2,1460,Seasonal,2025-01-29,0.76,"This is a romper featuring a relaxed fit with a flowy silhouette. It has a smooth fabric texture, spaghetti straps, and a V-neckline, with a short length ideal for casual outings. Suitable for warm, sunny weather, this piece is perfect for summer vacations or relaxed weekend wear."
PROD0297,Karakiri Vyre Cap,Karakiri,"Cap,Casual Cap,Streetwear Cafe Hopping Outfit","First Date Hats,Minimalist Cafe Hopping Hats,Minimalist Hats",Linen,Beige,"['S', 'M', 'L', 'XL']",Women,108000,35%,3.5,212,New Arrival,2025-06-16,0.85,"This is a baseball cap. Featuring a classic curved brim and an adjustable back strap, this cap is designed for a universal fit. Its solid color and minimal detailing offer versatility, making it perfect for casual outings or outdoor activities. The lightweight material is suitable for warm, sunny weather, providing comfort and sun protection."
PROD0298,Minimal Zane Strapless Blouse,Minimal,"Strapless Blouse,Business Casual Strapless Blouse,Formal Interview Outfit","Dinner Tops,Business Casual Wedding Tops,Business Casual Tops",Silk,Lavender,"['S', 'M', 'L', 'XL']",Women,286000,38%,3.0,156,Seasonal,2024-10-10,0.18,"This is a tube top with a fitted silhouette, featuring a smooth, satin-like texture. The strapless neckline and hip-length cut make it ideal for evening outings or summer events. Best suited for warm weather, this elegant top pairs well with both casual and dressy outfits."
PROD0299,3Second Jira Cap,3Second,"Cap,Casual Cap,Minimalist First Date Outfit","Campus Hats,Minimalist Hanging Out Hats,Minimalist Hats",Rayon,Gray,"['S', 'M', 'L', 'XL']",Men,444000,18%,3.2,1255,New Arrival,2025-04-23,0.67,"The main product is a cap.

This cap features a classic six-panel silhouette with a structured bill for a sleek look. Key details include subtle branding patches on the front and side, adding a touch of style to its simple design. Suitable for casual outings and perfect for warm, sunny weather."
PROD0300,HiGirlsLabel Zyren Wedges,HiGirlsLabel,"Wedges,Tropical Wedges,Tropical Beach Outfit","Vacation Shoes,Island Casual Pool Party Shoes,Island Casual Shoes",Linen,Turquoise,"[37, 38, 39, 41, 42]",Women,385000,25%,4.6,453,New Arrival,2025-05-25,0.76,"The product is a pair of wedge sandals. These sandals feature a bold tropical floral pattern on a sturdy platform wedge, complete with adjustable ankle straps for a secure fit. Ideal for summer beach vacations, they offer a vibrant touch to any casual outfit and are best suited for warm weather."
PROD0301,Gaudi Zyra Bucket Hat,Gaudi,"Bucket Hat,Casual Bucket Hat,Casual Hanging Out Outfit","Campus Hats,Casual Casual Date Hats,Streetwear Hats",Rayon,Sage green,"['S', 'M', 'L', 'XL']",Men,147000,27%,4.9,926,Clearance,2025-04-12,0.21,"I'm unable to identify the person in the image, but I can tell you about the product. The main product appears to be a bucket hat. 

This olive green bucket hat features a relaxed fit with a clean, minimalist design, accentuated by a small front logo patch. Made from breathable cotton material, it offers a soft texture, perfect for casual, everyday wear. The hat's versatile style suits outdoor occasions, particularly suitable for warm, sunny weather."
PROD0302,Cottonink Orla Lightweight Cardigan,Cottonink,"Lightweight Cardigan,Minimalist Lightweight Cardigan,Streetwear Casual Date Outfit","Campus Outerwear,Casual Campus Outerwear,Relaxed Outerwear",Wool,Coral,"['S', 'M', 'L', 'XL']",Women,112000,40%,3.9,1148,Seasonal,2025-06-25,0.29,"This is a cardigan. The cardigan has a relaxed fit with a draped open front silhouette, featuring a smooth, solid fabric texture and long sleeves. It is hip-length and ideal for layering in cooler, air-conditioned environments, making it suitable for everyday wear or casual office settings."
PROD0303,Karakiri Marry Lightweight Cardigan,Karakiri,"Lightweight Cardigan,Minimalist Lightweight Cardigan,Streetwear Hanging Out Outfit","Cafe Hopping Outerwear,Minimalist First Date Outerwear,Minimalist Outerwear",Cotton,Olive,"['S', 'M', 'L', 'XL']",Men,142000,11%,4.4,1321,Clearance,2024-11-25,0.37,"This product is a top. It features a relaxed fit with a round neckline and long sleeves, providing a comfortable and casual silhouette. The texture appears smooth with a solid olive color, making it versatile for various outfits. The length is hip-length, suitable for both layering and standalone wear. Ideal for everyday, casual occasions, this top is best suited for cooler weather or air-conditioned environments."
PROD0304,Gaudi Echo Slip-on,Gaudi,"Slip-on,Minimalist Slip-on,Minimalist Casual Date Outfit","Campus Shoes,Minimalist Campus Shoes,Streetwear Shoes",Wool,Brown,"[36, 42]",Men,486000,12%,3.3,1172,Clearance,2025-01-18,0.95,"The main product in the image is a shoe.

This sleek loafer features a streamlined silhouette with a smooth leather texture and slip-on design for easy wear. Suitable for formal occasions and office wear, it offers versatility in style and is perfect for all-season use in both warm and cooler environments."
PROD0305,Naomi Ivy Swim Shorts,Naomi,"Swim Shorts,Casual Swim Shorts,Tropical Swimming Outfit","Pool Party Bottoms,Summer Beach Bottoms,Beachwear Bottoms",Linen,Sage Green,"['S', 'M', 'L', 'XL']",Men,357000,34%,4.4,1345,New Arrival,2025-06-09,0.33,"These are men's shorts featuring a relaxed fit with an elastic waistband and a drawstring for adjustable comfort. Made from lightweight fabric with a straight silhouette, they include pockets and a subtle logo patch for added style, making them perfect for casual outings and ideal for warm weather."
PROD0306,New Balance Flex Basketball Shoes,New Balance,"Basketball Shoes,Sporty Basketball Shoes,Sporty Fitness Outfit","Fitness Shoes,Sporty Hiking Shoes,Sporty Shoes",Spandex,Orange,"[36, 37, 38, 39, 40, 41, 42]",Women,248000,34%,3.0,747,New Arrival,2025-01-14,0.2,"This is a pair of sneakers. These sneakers feature a streamlined, athletic silhouette with a mesh fabric upper for optimal breathability and lightweight support, complemented by a bold monochrome design. They are ideal for casual outings or athletic activities in warm, dry weather, offering sturdy support with a cushioned sole for comfort during any activity."
PROD0307,Karakiri Vyre Chinos,Karakiri,"Chinos,Relaxed Chinos,Streetwear Casual Date Outfit","Casual Date Bottoms,Casual First Date Bottoms,Casual Bottoms",Denim,Taupe,"['S', 'M', 'L', 'XL']",Men,360000,15%,4.3,1427,Clearance,2025-05-06,0.55,"The main product in the image is trousers.

These straight-leg trousers feature a classic, minimalist design with subtle stitching and a smooth fabric texture, offering a comfortable and relaxed fit. They are full-length, making them suitable for workplaces or semi-formal events, and are ideal for mild to cooler weather, or well-ventilated environments."
PROD0308,Velvet Riot Glow Suede Shoulder Bag,Velvet Riot,"Suede Shoulder Bag,Formal Suede Shoulder Bag,Business Casual Interview Outfit","Dinner Bags,Formal Business Meeting Bags,Professional Bags",Velvet,Dusty Rose,['One Size'],Women,149000,28%,3.2,1063,Seasonal,2025-06-17,0.73,"This is a handbag. The handbag features a crescent silhouette with a smooth, pleated design, adjustable shoulder strap, and a subtle gold-tone logo. It's ideal for everyday use and well-suited for warm weather."
PROD0309,Minimal Vira Waterfall Bolero,Minimal,"Waterfall Bolero,Formal Waterfall Bolero,Formal Dinner Party Outfit","Business Meeting Outerwear,Formal Interview Outerwear,Business Casual Outerwear",Velvet,Tan,"['S', 'M', 'L', 'XL']",Women,152000,20%,3.4,1426,Seasonal,2025-06-23,0.7,"This is a cropped jacket with a relaxed, open-front silhouette. It features a smooth fabric texture, three-quarter sleeves, and is hip-length, making it suitable for layering over casual outfits. Ideal for everyday occasions in warm, mild weather."
PROD0310,Cottonink Nalia Jumpsuit,Cottonink,"Jumpsuit,Relaxed Jumpsuit,Relaxed Casual Date Outfit","Casual Date One-Piece,Streetwear Casual Date One-Piece,Streetwear One-Piece",Cotton,Camel,"['S', 'M', 'L', 'XL']",Women,381000,39%,4.0,838,Clearance,2024-11-10,0.67,"This is a sleeveless jumpsuit featuring a relaxed fit with a draped silhouette, perfect for casual occasions. It includes a deep V-neck and practical side pockets, and the ankle-length design makes it suitable for warm weather."
PROD0311,H&M Mirada Wide Denim Jeans,H&M,"Wide Denim Jeans,Edgy Wide Denim Jeans,Edgy Party Outfit","Music Festival Bottoms,Glam Concert Bottoms,Glam Bottoms",Denim,Light Blue,"['S', 'M', 'L', 'XL']",Women,469000,37%,4.5,67,Seasonal,2025-07-08,0.62,"The product is a pair of trousers. These wide-leg jeans feature a high-rise waist and a relaxed silhouette, crafted from light wash denim with subtle fading and a distressed detail on the leg. Falling to a full length, they are designed with classic five-pocket styling and a button-fly closure. Ideal for casual outings, these jeans are perfect for mild to warm weather."
PROD0312,Skechers Noema Women Tank Top,Skechers,"Women Tank Top,Sporty Women Tank Top,Sporty Fitness Outfit","Hiking Tops,Sporty Running Tops,Sporty Tops",Cotton Blends,Magenta,"['S', 'M', 'L', 'XL']",Women,268000,16%,3.3,958,Seasonal,2025-03-09,0.55,"This is a sleeveless athletic tank top with a racerback design, offering a relaxed fit for comfortable movement. Made from a lightweight, breathable fabric, it features a plain pattern with no additional embellishments. The top is hip-length, making it ideal for gym workouts or casual outdoor activities in warm weather."
PROD0313,Zara Aeris Band Tee,Zara,"Band Tee,Edgy Band Tee,Glam Party Outfit","Concert Tops,Edgy Music Festival Tops,Glam Tops",Denim,Mustard,"['S', 'M', 'L', 'XL']",Women,184000,46%,4.8,217,Clearance,2025-01-02,0.5,"This is a dress featuring a relaxed fit with a straight silhouette. Notable details include a bold waistband with graphic text, crafted from a soft, smooth fabric. The dress has a crew neckline and short sleeves, offering a casual, effortless style. It is a midi length, suitable for everyday wear and casual outings. Ideal for warm weather, providing comfort and ease of movement."
PROD0314,Ecinos Kelis T-shirt Dress,Ecinos,"T-shirt Dress,Relaxed T-shirt Dress,Casual Cafe Hopping Outfit","Hanging Out One-Piece,Streetwear Casual Date One-Piece,Casual One-Piece",Wool,Coral,"['S', 'M', 'L', 'XL']",Women,131000,14%,4.8,729,Clearance,2024-08-09,0.13,"This is a dress. The dress features a relaxed fit with a simple silhouette, crafted from plain fabric with a smooth texture. It has a crew neckline and short sleeves, offering a comfortable and unrestrictive style. The length falls to the knee, making it ideal for casual outings or everyday wear. Suitable for warm weather, this dress is perfect for staying cool and comfortable."
PROD0315,Buttonscarves Cielo Waterfall Bolero,Buttonscarves,"Waterfall Bolero,Formal Waterfall Bolero,Professional Dinner Party Outfit","Special Occasion Outerwear,Business Casual Wedding Outerwear,Formal Outerwear",Silk,Amber,"['S', 'M', 'L', 'XL']",Women,374000,43%,4.4,43,Clearance,2025-06-15,0.37,"This is a cropped jacket featuring a tailored silhouette and a buttoned front, accentuated by ruffle detailing for added elegance. The design includes a scoop neckline and three-quarter sleeves, making it suitable for formal work settings. Ideal for cooler, air-conditioned environments."
PROD0316,H&M Tria Sling Bag,H&M,"Sling Bag,Bohemian Sling Bag,Edgy Party Outfit","Concert Bags,Glam Music Festival Bags,Bohemian Bags",Cotton,Beige,['One Size'],Women,154000,50%,4.8,1159,Clearance,2025-05-01,0.64,"This is a sling backpack with an inverted triangular silhouette. It features intricate woven patterns and fringe detailing on the front pocket. Suitable for casual outings, it is ideal for warm weather with its lightweight and breathable fabric."
PROD0317,Inkano Nara Straw Bag,Inkano,"Straw Bag,Island Casual Straw Bag,Island Casual Pool Party Outfit","Pool Party Bags,Tropical Beach Bags,Summer Bags",Lace,Olive Green,['One Size'],Women,127000,26%,4.0,542,Seasonal,2024-10-08,0.77,"The product is a bag. 

This woven tote bag features a structured silhouette with dual sturdy handles for easy carry, made from natural fibers for a textured finish. It's ideal for casual, everyday use, perfect for warm weather or beach outings."
